{
  "basicInfo":{
    "assetNo":"p02101101010101",
    "assetType":"product",
    "assetOwner":"sssR",
    "assetName":"N95",
    "productDescription":"kouzhao"
  },
  "detailedInfo":{
    "productId":1,
    "productName":"An ice sculpture",
    "price":12.5,
    "tags":[
      "cold",
      "ice"
    ],
    "dimensions":{
      "length":7,
      "width":12,
      "height":9.5
    },
    "warehouseLocation":{
      "latitude":-78.75,
      "longitude":20.4
    }
  },
  "dataInteract":[
    {
      "xPath":"$.basicInfo.assetNo",
      "interactType":1
    },
    {
      "xPath":"$.detailedInfo.dimensions",
      "interactType":1
    },
    {
      "xPath":"$.detailedInfo.tags",
      "interactType":1
    }
  ],
  "authorizationProperties":[

  ],
  "secretProperties":[

  ]
}